sentiment,text,data_id
positive,"If your buying this pump because your washer will not drain.  Make sure you check the upper most part of the drain hose, it is the part that has a plastic ball in it.<br />This pump was easy to replace and worked perfectly.  However it did not solve my problem.  I found a rag in the upper drain hose (See photo).<br />So make sure you sweep all the drain hose before purchasing anything for your washer.  If the pump is actually broken, this is an excellent choice.",20
positive,My machine has worked fine since I replaced this part.,20
positive,funciono muy bien,20
positive,Looks great. A bit noisy (moving a lot of air). Lamps burned out in &#60;12 months but are cheap and easy to replace. Great bargain - a fraction of the cost of comparable name brands.,20
positive,"I really love about this little fridge is that it doesn’t get hot to the touch. It’s conveniently sized so it doesn’t take up much room, yet it holds quite a bit on the inside. Very impressed. I’d like to keep an extra fridge in my bedroom for cool drinks throughout the night, especially during the hot summers. This fridge fits the bill and so much more.",20
positive,I like this pod because I can use my own coffee.,20
positive,No leaks and very long,20
positive,install was pretty easy,20
positive,This was a lifesaver.  Saved so much money!,20
positive,Perfect,20
negative,Didn't seem to fit as well as the one it replaced. But it's been working.  Would have liked a seamless perfect fit from the get-go.  Must have been a change in the part since our fridge was manufactured.,20
positive,I only used the ignitor and am saving the other parts for future use as needed.  The ignitor and included bracket fit perfectly and work flawlessly.,20
negative,Very dissatisfied. The filter had a metallic/chlorine taste (even after running it for 15 minutes). We drank the water anyway. It caused me to have a headache everyday. Once I stopped drinking the water from the fridge the headaches went away. We replaced the filter with an LG filter. No chlorine taste. No headaches.,20
positive,These were great for one shot but if your looking to fit a double shot in one cup it was too small and spilled but super cute to have use and the glass is thick and handle is very sturt,20
positive,These little STK Reusable Cups for Keurig machines are wonderful and works as advertised.  Thanks for making something both economical and environmentally sound.,20
positive,My dryer came with a 6 foot cord and unfortunately it was on top of the washing machine and was too short to reach the plug near the floor. So we had to order the 10 foot which was just perfect,20
negative,it didn't work after taking 2 hours for washer moving and replacement.,20
positive,"Replaced worn out valve on Maytag Neptune.  It pays to verify the serial number as the series is identified in that number.  This one took the smaller valve and it was a very easy installation.  It took less than 20 minutes to remove and install.  Recommend that you identify each connector so you can replace them in their correct position.<br />Valve came in a bubble pack and the valve itself appeared to have partial piece of tape on the two water inlets.  This was a new valve and didn't expect this.  Anyway, the washer is now working and that's the important issue.  Great value.",20
positive,Works as stated,20
positive,Great value,20
positive,Little bit of work to install the unit since I had to open a hole on the wall 😄. Otherwise this unit works perfectly.  Thanks,20
positive,Has the perfect scoop size for 10oz cup of coffee,20
positive,Excellent product. I recommend it,20
positive,Kinda noisy but works great,20
positive,"This's the way to go for those self own K-Cup users  where you use your on coffee on your Keurig machine. I use the stainless steel K-cup and spanish or espresso coffee grinds are very fine. These filter are the best by far. Never see a single grind at the bottom of my cup. For all you environmentalist enthusiastic people, the best part you can add this to your compose. Filter and all.",20
positive,This product works very well. Glad we got it. We are avid tea drinkers.,20
positive,"The exhaust fan works really well! I can’t find anything that I don’t like about it. It has very nice features and appearance. I love the fans gesture control, no need to touch the controls while cooking so it keeps it nice and clean. I haven’t used the remote control yet but am sure it will be a bonus. The noise level isn’t bad. The suction is very strong. I cook a lot and notice that I haven’t had to go past the 2nd power level to remove the cooking odor and smoke. I would definitely recommend this product. I have to mention that their customer service department was a pleasure to deal with which isn’t always the case in my experiences. They had a quick response time and resolved my issue with a complete replacement. The price was reasonable, I’m very happy with this quality product.",20
positive,Finally a reusable k-cup that works for my Keurig Supreme Smart coffee maker. Hopefully that will continue with use and there will be no leakage or grounds in my cup.,20
negative,"The construction of this filter is not very sturdy.  I can see that if I am not careful with it, I will have to replace it soon.  It is the only filter that fits my coffee maker so I have to use it.",20
negative,"I wanted this to be good and comparable to the LG 600 filter, but after the kids tasted the water, they hated it and said it tasted weird. So I'm going back to the $50 filter!",20
negative,"I suspect the small plastic nodes aren't strong enough to hold the louvered door in place, since I've found it lying on the sidewalk outside my dryer two times. My next step is to use duct tape to keep the door intact while I buy a replacement. Unfortunately, my painter installed this one, then painted it match our house color -- so I'll need to redo that unless I want it to stay white. Don't recommend.",20
positive,I was looking for the filters in Amazon and I think this is the only right one that fits my exhaust fan.<br /><br />Hopefully it will last.,20
positive,Part came quickly and was just what I needed to get my washer going.  It was identical to the part I removed. Thanks!,20
positive,So far this freezer has worked flawlessly. I really like the digital temperature display and LED lights in the freezer door.  I set the temperature to maintain 5 degrees and a separate thermometer has verified the accuracy within +/- 1.3 degrees.,20
positive,"I have been looking and looking for reusable cups the not only fit but would work in my machine. These worked so well, I ordered more. Love this product.",20
positive,Product looks like the original fit like a glove.  The hoses and wiring clips all went back on easily.  Hopefully the build quality and function are also good but only time will tell.,20
positive,I like this product,20
positive,Saved me from having to call in an appliance repair or buy a new dryer.,20
positive,Excellent product. Exactly what I needed for my electric panel for brewing.,20
positive,"Great little cartons, but like the description says jumbo coturnix eggs do not fit:(  Some are hard to close.",20
positive,I got these fast and the product was as described.  I fixed my washer in 5 minutes.,20
positive,"Lid actually closes. Thick plastic. Even comes with its own bag. Bought this for Thanksgiving, and this will make it easier for us to carry our deviled eggs.",20
positive,wroks great,20
positive,I was hesitant to buy appliance parts from someone other than the manufacturer. But this part is a direct OEM replacement and the appliance is back to working perfectly.,20
positive,Perfect for most dryers if you're not getting a flame. Much less expensive than going through your local parts dealer.,20
positive,The is as advertised. Work as expected in my Samsung fridge.,20
positive,These are great. The orange opens up the larger oz options for travel mugs. I use both all the time. Saves money. I use them in my purple K250 and I also bought them for my mom to use in the K350 I got her. Works in both with no issues and no clips or mods are needed.,20
negative,Web site claimed it would fit. It did not. Showed to repair man. He told me it would not connect.,20
positive,"Correct product and fits perfectly. A little more pricey than other replacement screens but, they're quality made.",20
positive,Look good on my stove,20
positive,"I bought these twice.  (Actually, four times -- twice for each sized burner.)<br /><br />Yes, the liners are cheap, thin, and flimsy.  But what do you expect -- a $30/hour house keeper to scrub your stove until spotless?",20
negative,2 small for coffee pot and grounds get in the bottom of your cup,20
positive,Seems to be correct part and works as it should,20
positive,Spare,20
positive,Great value and high quality,20
negative,It worked great for the first week or so - was making ice non stop.<br /><br />But then it stopped making any ice at all.,20
negative,We really like these filters. I just ordered a box of 300 but received a box of 100 with a 300 sticker on it. Returned it and received the same thing again. I knew it was the wrong number because the box was a lot smaller than my prior purchases. Great product but make sure you are receiving the correct amount.,20
positive,"Fantastic dryer. I would definitely suggest it to anyone! & it’s beautiful. (I got the blue. Has gold trim around the door)<br />It does dry great. It is not noisy/loud. Not heavy. The door has a really strong magnet, and doesn’t pop open. And a very good purchase price.<br />Oh, and I haven’t noticed any difference in my elec bill. I use the dryer 1 day every week, for about 5-6 hours.<br /><br />But it’s not TOTALLY worth 5 stars…<br />To me, these are KINDA minor, as the dryer does work great.<br /><br />1) It takes a longg time to get hot. Once started, it’s roughly 30-40 mins be it’s actually hot enough to start drying.<br />On the high heat setting, without overfilling… it pretty much takes the full 130mins it is set to, to fully dry everything. (And the timer cannot be changed, btw)<br /><br />2) The little power button light is annoying (to me, at least). It fades on & off constantly, like a 2 second cycle of each. It’s in my bedroom, so it’s super annoying. Lights up the room more than it seems like it would. (I think I’ll just unplug it, and only plug it in when using)<br /><br />3) The vent hose does not stay on the back, and the little screw with it does nothing. I took some packing duck tape, and just used a few pieces to hold it on. Stays great now.<br /><br />4) The lint trap is really hard to clean. It’s kinda hard to take the whole thing apart. And the actual trap is a very, very thin piece of felt… super hard to get lint off, and feels like it will tear easily.",20
negative,The parts lasted 3 weeks.,20
positive,Got it on time and everything works beautifully. Always good////////1<br />Betty,20
positive,Worked perfectly in the Keurig.,20
positive,"I purchased this because I wanted to get away from using the typical plastic pods, since plastic is bad for the environment and our health.  This is very easy to use. I’m careful to place it in correctly so that the needle isn’t broken.  So far, I’ve enjoyed using it!  Recommend!",20
positive,I liked it,20
positive,These filters fit my Samsung fridge and for the price well worth it,20
positive,Good so far. It is a little noisy,20
positive,"[[VIDEOID:276622104beec0fc8b199dbd537d405b]] So pretty and it works wonderful i can barely hear it, the ice is very good this ice machine is fantastic and affordable. Thank you Igloo",20
positive,"I like, used to replace a defective detector, it works",20
positive,Just fine,20
positive,"Is a perfect fit but reading previous reviews from different websites that this part is pron to brake again , I glued it with contact cement.",20
positive,Justo el mismo repuesto original por el que sustituimos el malo. Perfecto,20
positive,Fits right on the counter. This makes my day so much more easier.,20
positive,"This is a great little machine.  With the many different small dryers available this one was the right chose,",20
positive,Worked perfect for my dryer and was easy to install. At sears they wanted around $65 for a new oem part so this is a much better alternative.,20
positive,"I have a Bosch dishwasher, in this was exactly what I needed. It was a complete match and went in perfectly. I'm so glad I purchased this from Amazon.",20
negative,It ok. Just didn’t fit the pan and the brace under the burner was loose,20
positive,We bought the filter cone for a vacation and wanted to bring our own &#34;good&#34; coffee with us. It is perfect! It folds down to a very small size so it packs easily. It otherwise works like a regular filter cone. We are very happy with it!,20
positive,Very easy to installed. Had the dishwasher back running in no time.,20
positive,"Not noisy, good light distribution. Great product, especially for the price",20
negative,Not happy at all and I really wanted it to work.  If I get my issues resolved I will change my review but for now I received it yesterday.  There is a whole broken on the inside of the wash bin part and if its meant to be there it look very poorly cut out and if water goes into it I'm pretty sure it will get all over the electrical.  I don't know it just doesn't look right.  It leaks really bad from the drainage part and I checked the tube and its not broken.  I'm really upset and would like one that works. Please,20
positive,"Great product and it has made a big difference.  In the past, the filter would be growing something and have a funky smell.  This season, that didn't happen.",20
positive,"Works like new one. Fits as is, do not trim it. You just need to push the slack farther into the channel.",20
negative,"Easy enough to put in, but after a month or two seem to pop out of the track easily, not hard to put back in just annoying when the rack is already loaded with dishes",20
positive,cuando recibo mi reembolso no está en mi tarjeta,20
positive,Nothing to dislike. No noise level. Love everything about this item.,20
positive,"I kept hearing bad things about the new replacement filters Honeywell came out with and was THRILLED when I saw these. It's pretty much a duplicate of the one that came with my humidifier! Perfect size, shipped so quickly and I am so happy to be using these versus the subpar ones with the blue lining!",20
positive,Quick shipping & good quality. A+A+A+,20
negative,"The magnetic stripes does not go all the way around, this cause it not to seal. This knock off does not make the cut! NO WAY THIS IS OEM.",20
positive,"Fit as listed, great quality",20
positive,These work great! Definitely a steal,20
positive,"I bought this back in June or July, I moved into a travel trailer and was looking for alternate Way to do my laundry to keep me from going to the laundry mat. It is now November, and I have to say best purchase I could have made. Now keep in mind this isn't a high-tech big washer. I can't wash my bed comforter it's too big for it. I also only do my own laundry I'm not washing clothes for a big house.  The main complaint I would have on it is the pump to push the water out of the tank isn't very strong. So the side hose where the water drains out if you have that leftover something it won't drain out, it won't push the water out. My solution is to just lay the hose flat. Originally I wanted to be able to move it into my bathroom and drape the hose over the bathtub and have it drained out there but that was not a option. Instead I just keep the washer outside in a shed, or use the water hose to fill it up and to rinse the clothes off. The dryer ringer works better than I imagined it would, sometimes I might have an issue getting it balanced but as soon as I do the clothes will ring out fairly dry, do you keep in mind it's not a heating dryer so of course you're close will still be damp when they come out I just hang them on the line after that. I was worried after I first bought it I was playing with the timers end it stopped working. I thought I was gonna have to return it and get a new one or a different product, but I love the timer timeout unplugged it plugged it back in and then it started working again just fine, I haven't had any issues since then. Overall for the most part I am pleased only thing I would change on if I could is a stronger pump, but if you don't mind having it outside and just laying the hose flat he won't have much of a need for one.",20
positive,Item received was DA29-00020B for use in System DA97<br />Item needed was DA97-17376B as you can see.  anyway My Brother has a Fridge that this cartridge may fit so I'm giving it to him.,20
positive,Product as expected.,20
positive,"Installed this on a Saturday afternoon. Some of the instructions are a bit confusing. They appear to have been translated into English by a person not entirely familiar with American English or even the Queen's English. If one is familiar with working with gas appliances, it is not an issue. If you're not, and you plan on doing this yourself, take some time to check out some of the tutorials on gas stove installation available on the internet before starting.<br /><br />Stove comes with fittings for both LPG and natural gas as well as a spare set of jets. The brackets included to secure the top to the counter may not work for you. They didn't for me. My counter is too thick and had to make my own brackets.<br /><br />Overall, it is well constructed even though it isn't as sturdy out of the box as something like a Bosch. Once it is installed, that slightly flimsy impression goes away.<br /><br />I didn't have to adjust the new pressure regulator (included) after installation. It was set appropriately for my setup. You will need to provide gas rated PTFE tape to seal the connections. This is YELLOW Teflon tape. Don't use white Teflon tape. Check your seals with soapy water to ensure you have no leaks.<br /><br />This replaced a GE Profile gas cook top. So far, I've prepared two meals using this cook top. I'm very pleased with its performance. The large burner in the center handled my wok and I was able to whip up a stir fry easily.<br /><br />Other users have complained about difficulty getting the stove to ignite. Remember when you first assemble, and turn on the gas, there is air in the internal lines in the stove. Open the valves on all burners until you smell gas to purge the air from the system. Vent the room and then try and start. Mine fired right up.",20
positive,"Perfect solution to those wasteful pre-filled plastic Kups you can buy that end up in a landfill. Pop one into your preferred holder, fill with your favorite grinds and that’s it. Once the coffee is brewed, toss the biodegradable filter into the garbage and you’re done. I’ve been buying these for years and they’re highly recommend.",20
positive,couldnt find these locally but it was the exact replacement for my dryer,20
positive,Great buy,20
positive,"Purchased this to replace the original filter in my LG refrigerator. It works as advertised and keeps the ice and water tasting good. I wish it was a little less expensive, but Amazon still had the best price I found.",20
negative,I loved this sealer until it stopped working after having it barely over a month.,20
positive,This fixed my Kenmore HE4 dryer. I changed the dryer element and the two sensors on the outside of the heater element container. My dryer works great.,20
positive,Perfect for the job. Just what I needed.,20
positive,"Super easy to install, easy to clean.",20
positive,Fits perfect! So glad my washer is actually washing again!,20
positive,Glad I got this new version.,20
negative,Does not seal well,20
positive,Great price.,20
positive,"Excellent product,perfect fit and works well.",20
positive,Very sturdy and the written measure marks are very easy to see. I use this in my Keurig because my tall travel mug doesn’t fit under the spout even with the tray removed. So I brew the coffee into this container and use the easy spout to pour into my travel mug. It’s shape and material make it easy to clean.,20
positive,This Ice maker worked perfectly as a replacement for the one in my 16 year old Jennair Refrigerator (JCD2389GE).  I was able to replace the old unit in under 20 minutes with no more than a small hex wrench.,20
positive,Works great. Great price. Will buy again!,20
positive,Absolutely no complaints. I needed to replace my old dryer duct. This was the right size. Fit over the dryer and vent tube no problems.,20
positive,Nice..,20
positive,very nice,20
positive,"Great product, works well.",20
negative,"Save your money. I've had two of these units fail, each after only 90 days.",20
positive,Great element and great price. It was very easy to install.,20
positive,Great price and works great as well as he style and material. Satisfied.,20
negative,I ordered this part only lasted six months so I ordered another one only lasted 6 month complete junk! Don't buy!!!!,20
negative,This little machine is so freaking loud and knocks around. I have it on a flat surface in my laundry room and when I say it's loud it sound like it's going to take off from the helipad. So of course I immediately unplugged It for fear it would explode while in use. I know it is compact so I only put a few items of my 5 year olds in it to test it out. I wish I had a better experience and it's my first time using it right out of the packaging. Kinda a waste of money 🙄,20
positive,"Great quality , fit and price",20
positive,This little thing is awesome! Cleans very well and is very easy to move around. Hooked right up to the bathroom faucet. My on complaint is if you have to drain back into the sink the drainage tube will certainly pop out and begin to drain onto the floor since there is not a good way to secure it. A little 3d printing and some thought and I now bracket to couple the drainage tube to the supply line. Homelabs should ship something similar with this washer as this is not a fun surprise!,20
positive,Easy to install,20
positive,Great price save’s investing in k cups,20
positive,"Looks great and works great.  Only complaint is the directions are generic and the upper vent/chimney was difficult to install.  The installation kit includes flexible hose, but needs to also include a good zip tie.",20
negative,One of the reusable kcups didn't fit my Kourig. Neither did any od the kcups filters.,20
positive,Great fit and worked for repair.,20
positive,Worked perfectly exactly what I needed to fix the mixer,20
positive,Exact fit and worked perfect,20
positive,Great product and even better customer service.,20
positive,Works 0n GE refrigerators as advertised,20
positive,Works like the more costly product sold by whirlpool,20
negative,Used to supplement refrigerator ice maker. Worked well for three weeks then the machine would not stop making ice when the ice bin was full. Cleaned and made sure the sensor was clear with no effect. Returned for refund.,20
positive,Good product!,20
positive,Love it. Saves me so much money,20
positive,Theyre coffee filters....they filter coffee. If you can't find filters for your sisters weird little European coffee brewer. You found it. And there's enough for a 100 uses!,20
positive,Great,20
negative,Didn't even work for half an hour. No user serviceable parts.,20
positive,The whole Aeropress system is the best!,20
positive,This product works well in my Aircare evaporative humidifier. It prevents mold which would be detrimental to health.,20
positive,Works great on light clothing.<br />Didn't work on my blankets.,20
positive,Nice,20
positive,"I have the counter-depth Samsung RSG257AA, which calls for the part #DA29-00003B.  This product is the DA29-00003G, which claims to replace the DA29-00003B, and while I was able to make it work, it required cutting away a small portion of one of the plastic tabs that help lock it in place.  You may have the same issue too, which is odd since the maker of this filter is the maker of the filtration system in the refrigerator.",20
positive,"Simple and easy to replace, fit perfectly",20
positive,Very easy to install and was a perfect replacement.,20
positive,These pulley rollers were able to work as replacement pulley rollers with my drier.,20
positive,I have tried am several ice makers and this is the only one that has not stopped or plugged up or did not make much icthis makes ice cubes fast. It is a great machine,20
positive,Best deal I’ve found for the charcoal filter for a keurig,20
positive,great product..,20
positive,"Have given up on finding an OEM part, this works fine. Not as much crema but flavor is good.",20
positive,just what i needed..!,20
negative,"These are OK. They're remarkably inexpensive, but they darken fairly quickly.",20
positive,"The Whirpool stacking kit consists of two metal brackets and four plastic feet.  This kit is half the price of the official brand.  Works fine for stacking the units.  Comparing to the kit in the hardware store this is similar, but the brackets have a little different finish. Packaging was pretty generic and include a photocopy of the official whirlpool instructions. Differences are minor, and for $20 or so savings this does the trick.",20
negative,product although nice on the eyes does not match the measurements provided for the larger size pan. It does not fit the range.,20
positive,works great!  And at a great price!,20
positive,Does its job.  High quality,20
