sentiment,text,data_id
positive,No evidence-based complaints so far but was disappointed when I pulled out the Samsung filter to see one o-ring seal on end and two further back but this product only had one and one. There's a reason Samsung puts one and two. For an extra couple dollars couldn't this vendor also have put one and two??,20
positive,can use dryer.  hope it lasts.,20
positive,"I was a little apprehensive when I saw all the pieces. But the instructions point you to a youtube video, and after watching it this was no problem to install, pretty quick. Now the upper rack isn't flopping all over the place. Very happy.",20
positive,Works so much better than the after market or fake brands. Insanely expensive.,20
positive,"parts for this old ice maker is hard to find, thanks for having it. fits perfectly",20
positive,Save some money being able to use your own coffee. Works well in Kerig machine just make sure that you grind your coffee pretty fine also like Expresso.,20
positive,This was exactly what I needed and worked perfectly!,20
positive,"product works great, have used same filters for years",20
positive,Purchased this part for a Wolf range model #R486G.  Great fit.  The ignitor comes with plenty of wire length.  I actually had to trim some off so there wouldn't be so much slack that may find its way near the burner.  Only complaint is the cheap wire nuts that come with it kept on spinning and didn't lock down on the wire splice.  But that is a minor complaint.  I used some spare wire nuts I had laying around from other jobs.  Will definitely buy again once the larger companion oven ignitor goes but hopefully that won't happen for a while since we mainly use the smaller oven.,20
positive,Excellent,20
positive,Works great at a fraction of the whirlpool price,20
positive,They worked perfectly!! Love them!,20
positive,"I received this product on time, and installing it was a breeze.  I ran 2 gallons through it, and the water is clear.  Since I only use water in coffee, etc., I can't say anything about the taste, except my coffee tasted the same or better.  I would recommend this water filter for purchase.  Making it even better, is it cost half what the dealer charged.",20
positive,I bought this item to dry my sneakers. It works great.,20
positive,"Works good in my fridge.  This is the second one I have ordered.  I feel like the price is kind of high for what it is, but you got to have it.",20
positive,Perfect fit. Easy install and works better than the original.,20
negative,"I have chickens that lay large eggs and I was hoping this would work, but the lid wont close with my large eggs.  It would work for small, store type eggs maybe.  It is sturdy enough to hold eggs so I was disappointed at the depth of the container.  I think I can use it for christmas storage maybe",20
positive,"Great product. GE wanted $89.00, great deal on Amazon.",20
positive,What I exspected and was easy to install,20
positive,Just as good as name brand,20
positive,Everything I needed it to be.  It is large enough to be practical but small enough to not be obtrusive.  I would recommend this for anyone who needs just a little bit more freezer space.,20
positive,Perfect replacement filter for my GE Microwave.  The filters are very high quality.,20
positive,Excellent product performing as advertised. Great price and worth your consideration as an OEM replacement.,20
positive,Exact factory part for my Frigidaire dishwasher.  Very easy to install. I waited a long time to review the product as I wanted to see how well it worked.  Most Awesome!,20
positive,Love it,20
positive,"I have the Samsung Family Hub and these filters were really expensive to order through the app, this was a great price and so far so good.",20
positive,"Good dryer vent, but it does not open all the way when dryer on. Kind of scared the dryer going to burn with all the lent in the pipe!",20
positive,Great price!,20
positive,Fit perfectly in my Samsung Washer.  Easy to replace valve.  Took about 30 minutes total time.  Make sure you open the top cover of your washer and verify the part number you need before ordering.,20
positive,No room in my fridge for ice so I bought this and it is on my counter,20
positive,Immediately improved the water pressure in my fridge water! Filtering out the sediment that was slowing things down.,20
positive,These replaced another set that were just old & not cleanable anymore. They were a perfect fit/match & look much nicer than my old ones.,20
positive,Love these.  Just fill with your favorite grind and brew,20
positive,Finally found this and ordered it and love it,20
positive,"Works great so far. I shoved it in, water coursed through it in magnificent fashion, and water came out the thingy in lovely clear liquid form.<br />If it blows up in the next six months, I'll come back and let you know.",20
positive,Oven,20
positive,Good product,20
positive,"So far so good, item is as expected. Hopefully it will last us quite a while before needing a replacement,",20
negative,"too small to work, had to return.",20
positive,Received as expected. Easy to install and fixed my refrigerator. Easy peasy!,20
positive,Got filter very quick and gives excellent water taste,20
positive,"Not sure what the thickness rating is supposed to be but the product was sturdy and installed very easily.  Strong enough exhaust for my hot showers. Noise level is moderate, about what I expected and given the exhaust performance it’s totally acceptable.",20
positive,It seems to be just as good as the recommended brand and is a fraction of the cost. Did not have any problems changing it out.,20
positive,It works. That's all I need from coffee filters.,20
positive,I found out about these during quarantine and hate doing dishes. My place i live in is pretty small and this thing does wonders. Got it on sale and didnt know if it would be easy to use. It is and is amazing.,20
negative,"I bought the hood three months ago. When it first arrived, i tested it, it works fine. Now after three months, we finally got time to install it and when we turn it on. It runs for few seconds and then never turns on. It stops working. I think it is terrible. We never used it and it just went bad. I dont know what is wrong. Now i found out i pass the return period. I cant return or do anything.... What can i do???? Goshhhhhhh is it this weak?? Anyone has the same experience?",20
positive,product was just what I needed will purchase again,20
negative,"I RECEIVED THE PART PROMPTLY. HOWEVER, THE PART DID NOT WORK WHEN INSTALLED.  THE PART ACTUALLY LOOKED LIKE THE PART I JUST REMOVED.  IT LOOKED LIKE IT WAS A RECYCLED PART. I HAVE REPLACED THE IGNITER ON ANOTHER OVEN AND THE PART WAS DARK BLACK AND GRITTY AND SHINY.  THE PART THAT I RECEIVED WAS GRAY AS IF USED AND NOT VERY GRITTY AND DULL.",20
positive,Better than the original filter provided with the humidifier and cheaper.,20
positive,"This was just what we needed to replace our old and damaged silverware basket.  After looking for the exact part and comparing prices, several reviewers said this one was just as good for the best price.  I measured our old one and it seemed like this would probably work.  It does! Why pay more?",20
positive,"Perfect fit, easy replacement. Instructions to modify for belt tensioner sensor could be easier to understand.",20
positive,It great 👍,20
positive,"It replaced the old thermostat. It took about 30 minutes and within 24 hours we were at 0 degrees, and still holding.",20
positive,I am so pleased with the quick delivery and the product quality.many thanks...👍,20
positive,Fit and works great fast shipment?,20
positive,Love my reusable K cups and the fact you get the water filters included in the package was a great bonus for the price.,20
positive,Just as advertised.,20
positive,Great quality.  I bought because of the controls at the bottom worked for my custom range hood.  Very pleased.,20
positive,Was getting the same message on these type of larger orange replacement cups.  Bought another reusable and it was all black with a white dot at the 9 o’clock position on the lid.  Worked fine on my 2.0 Keurig so I made a removable white tape circle and viola both replacement cups worked like a charm. Not sure why mine didn't initially work and bought another orange one at walmart and it too did not work.  Love the ability to make either a pot or larger cup of coffee than 10 oz.,20
positive,Received the items in a reasonable amount of time. It included everything listed and the parts are durable and reliable.,20
negative,Connections are not secure without a bunch of tape. The Velcro clamps do not work. Great product in theory. But still needs work to be user friendly.,20
positive,Im verry happy 😃 Thanks!!,20
negative,"I didn't find it to be loud, like some mentioned. BUT ...the ice tasted like oil, really gross. and the ice cubes were dripping wet, even immediately after being dumped in the tray. And lastly, there's barely a difference in size between the small and large.",20
positive,"I only used it once, but it is easy to use and takes the wrinkle out right away. No need to keep on go through the material over and over again.  The size and portability seems to be appropriate for long trips.",20
positive,Was sent very quickly. Fixed the dryer. I can’t be happier.,20
positive,Worked great. Used for Dishwasher in my residence,20
negative,Size is not 89 1/2. Please add accurate size. It would be very helpful.,20
positive,It was drying REALLY slow when the old coil snapped. :P,20
negative,Recieved maca powder instead of reusable k cups,20
positive,Arrived quickly. Easy to install. Good price.,20
negative,"Mi compra fué por la malla/filtro bodum y me fué enviado otro repuesto la base o placa donde va colocada la malla/filtro); pienso que la descripción del producto está mal posteada, las fotos colocadas para la venta no coinciden con la descripcion del producto real.",20
positive,I love the product it works great for my needs.,20
positive,Much stronger than originals!  I wish I would have bought it a long time ago!,20
positive,Its made with nice and heavy steel. Perfect for milk frothing. Love it!,20
negative,Good size and price but inaccurate. Useless for me. I do not recommend.,20
positive,"Repairman wanted over $100 to repair the latch on my Mom's old dryer. With this kit, it took me all of 10 minutes. Kit came complete and it was so easy to do myself. Pretty intuitive, but an instruction sheet was included.",20
positive,Perfect for the big boxes of eggs I buy,20
positive,Was what I expected.,20
positive,"After looking in the hardware stores and online at appliance parts sites I wondered back to dependable Amazon.  Found these with total price less than what one would cost at the fore-mentioned stores and knew if they weren’t acceptable I could simply send them back.<br /><br />Put them in as well as the pans I also purchased, worked great and now the stove - top looks and works like new!",20
positive,"My husband works out of town and lives in our camper and the little fridge has no ice maker.  I got this for him to sit on the counter and not need a hose for water.  It small, light weight and easy to use.  Plug it in, turn it on add water and with an minutes you have your first dump of ice.  When the ice basket is full it stops making ice.  The ice is good and solid so stays frozen for a long time. We are saving so much money now instead of him having to buy bags of ice.  This was money well spent.",20
positive,We had a similar ice machine that stopped working.  Ordered this one and am so happy.  Makes batches of ice very quickly.,20
positive,"This range is amazing.  It is leaps and bounds above its predecessor.  The Wi-Fi is kind of useless unless you remember to hit the button all the time but it heats well, and the Power Burner that can actually reduce all the way to a true simmer burner is perfect for soups and other large cooking items that I used to have to change burners all the time.  The oven lights are ridiculously bright and the easy roll tray in the top oven really helps so you don't accidently touch the sides.  Is it worth the price tag, maybe not but it is probably the best performing stove I have ever owned.<br /><br />After reading another review on here I think it is worth clarifying.  Originally we purchased the all gas version of this oven and had nothing but issues with the pre-heat.  The oven would continuously turn off.  GE replaced the oven twice and serviced it three times before allowing us to swap to the dual-fuel version.  Since the switch no issues and we are almost a year in.",20
positive,Good quality.,20
positive,Works great for a #2 filter! The only issue is I can’t use it on certain cups because the ring on the bottom (that keeps it from slipping and sliding off your coffee cup) is an oval rather than a circle like my other pour overs. So if you have a more narrow opening for your coffee cups it won’t sit right.,20
negative,"I purchased this freezer less than a year ago, and it has begun randomly tripping the dedicated circuit breaker, meaning that, without warning, our frozen food is left to spoil. So far, we've lost about $100 worth of meat. After doing some research, I found that this problem has to do with the circuitry of the unit. I called Curtis (the manufacturer behind these RCA and Igloo freezers) and jumped through a few hoops with pictures, serial numbers, etc. over email. Then about six weeks later, I received an email stating that in order to proceed with the warranty, I would need to cut off the power cord and take a hammer to the front and back of the unit; then, take pictures of the destroyed unit, peel off the stickers with serial numbers, etc, and mail them in. After all this, Curtis would decide if my claim was worthy of a repair(!) or a replacement. There was no timeframe given for receiving a resolution. And in the meantime, I'm without a freezer, defective or otherwise. Oh--and I have to pay the disposal fee for the destroyed machine.<br /><br />I feel like I'm on trial for purchasing a defective freezer from Curtis. Here's an idea: Don't make garbage in the first place.<br /><br />Amazon, please begin making your own appliances. Put these con-artists out of business. I know your customer service will be better than this--and I will gladly be one of your first patrons.",20
positive,Can't beat the price!,20
positive,just fine,20
negative,Wrong size.,20
positive,Was a easy install and easily replaced the old one.,20
positive,good product,20
positive,As usual arrived quickly with prime order and product was easily placed in refrigerator.,20
positive,You can use your favorite brand of coffee and make it as strong or as weak as you like.,20
positive,"Excellent filters. They definitely do a  great job at keeping extra oil out of the coffe and they don't get soggy when used like a paper filter, overall very happy",20
negative,"While these definitely cut down on the grounds you get in your cup from using the filter basket without, they are still pretty messy and allow some grounds through.  Recommend the filters with the top flap as a better choice.",20
negative,"[[VIDEOID:f842f5c6195cbf433079d37c1d74f848]] I really wanted for this product to work but there are a few design flaws. I used it a total of 2 times and the bottom connecting piece to the motor came off. Tried to screw it back in, fell off again after a few minutes. The top lid to contain the water does not latch on, this machine is held together in place by the miracle of gravity.<br /><br />This product comes in two pieces so the point of connection is weak, it doesn't even latch to stay in place. For the brief moment it worked it was decent and the spin option was as well. You can only fill the bucket no more than two third or the water will spill because the rubber part is to soft and bends letting lots of  water out and flooding your floor (happened twice -_-). The motor smelled overheated after one use.",20
positive,Wheels look to be identical quality as the originals.  Easy replacement.  Back to dishwashing!,20
positive,I have this old fridge and all the bins broke but I’m not ready to purchase a new fridge so I went to the Sears website and found my model and searched  it. I found the parts number I needed and made sure it matched the compatible number it advertised. It fit with no problem! I’ll update how long it lasts later but so far so good!,20
positive,"The price speaks for itself especially when you consider the two most popular home improvement stores sell the same oven for $100.00 more. My only real disappointment was although it came quickly the first one came with a shattered door like several others experienced. Amazon very quickly replaced it, it came a day sooner than promised. The packaging inside was a complete redesign from the first one and the oven was in perfect condition. It took about 5 minutes to attach the supplied pigtail to the unit and another 5 minutes to make the connections to the house wiring and slide it in the opening in the wall. There are two very convenient handles incorporated into the sides of the oven to facilitate this part of the installation. Since I am replacing a twenty year old oven and I’m well into my seventy’s the push button controls are a bit of a mystery but so far it’s been interesting exploring them. I do wish a book had been included but Amazon does provide a link to one. The online instructions details a burn-in procedure to remove manufacturing oils , be sure to provide ventilation. The oven was installed less than one hour and we received six compliments, mostly younger people. It’s very attractive and even cooks well. It will work out perfect for my wife and myself.",20
positive,"The smaller filter for the Cuisinart &#34;keurig&#34; type coffee maker, I could not find these filters in any store!",20
negative,"The flow rate of these filters when installed on my Samsung refrigerator is EXTREMELY LOW. Without a filter, an average size cup fills up in 10 seconds. With one of these installed, it takes 1 minute or so.  The output is barely a trickle. The water does taste clean, but it is such an inconvenience to fill a glass, I've resorted to using the faucet instead.",20
positive,Cubes melt too quickly while waiting  for the basket to fill,20
positive,Perfect replacement for my old Frigidaire ice maker that stopped making ice.,20
negative,They are nice and east to clean they fit well the problem I have with them is the magnets that hold them came unglued from the caps themselves,20
negative,This item says universal but it was to large fir my kuerig.universal means all correct.,20
positive,to filter my drinking water,20
negative,Broke after 2 months of use. Such a waste of money,20
positive,This was the second time I ordered this part. It dropped right into place and got the heat to work on my dryer again. Will order again if the dryer needs another one. Make sure to check the continuity of the old parts with a multimeter to be sure what needs a replacement. There will be no continuity (no beep sound) across a bad fuse.,20
positive,OEM replacement at nearly half the price of a big box store. Fit right in.,20
positive,"I'm a single guy, live alone which means the ice machine had minimum use.  Water indication light stopped working after 4 mos, no biggie at first, but now it doesn't work at all.  The Fault Alarm light just displays.  Sent email to manufacture as there is no 800# to call.  Still waiting on response.  Unit comes with 12 month warranty.",20
positive,"Very easy, for my husband to replace. He did need to use his own tool as this kit didn't  include one.",20
positive,Great deal 3 filters for the price of 1!,20
negative,"Nice filters for the frig, but this new filter model costs twice as much as the discontinued one, and it does not filter anything more than the old one; plus the directions indicate that it has a shorter life span. Took off one star for Whirlpool doubling the price, and another star for designing the filter to last nearly half as long. I'll probably still use the filter until the frig's end-of-life indicator goes off, instead of the taking Whirlpool's recommendation. I still wouldn't want to go with a generic filter model, unless I find one that appears to be equal quality of the OEM.",20
positive,"Perfect size , low noise at spinning time , many cycles , easy install , I love it .",20
positive,"We use this ice cub maker all the time.  You need to find a good place to keep it to be able to use all the time.  It's not small, but small enough to find that perfect spot close to an outlet.  Easy to fill with water to make the ice cubes.  Makes them fast, in about 10-15 minutes for each batch.  The basket fills in about 45 minutes.",20
positive,This product has been great. It was almost plug and play replacement for our old system.  This is attached to our fridge. Love our ice cubes. Best tasting ever. Ours came with extra filters. This was about an hour install for my husband. Worked great.,20
positive,"I had my doubts, but it fits perfectly.",20
positive,"the idea of putting these heat-resistant sleeves on the front of oven racks seemed great - they'd let me pull out hot oven racks without burning my fingers or hand - but I've been disappointed by this sort of thing before.  I expected them to be flimsy, or not really stand up to heat.  But when I put them on, they worked exactly as promised.  I can open the oven, pull a rack out to put something on or take something off without putting on a clunky oven mitt or grabbing a dish towel.  That seems like a small thing, but it changes the way you use the oven.  Putting them on the racks took a bit of dexterity, but once on, they've been doing their job flawlessly for several months - exactly as I'd hoped and much better than I'd expected.",20
positive,The price is right just what I need,20
negative,Never wouldmbuy agaiin. Junk that I hey wont return,20
positive,"This is something we didnt know we really needed, our washing machine has never been cleaner! Thank you",20
negative,Cheap as hell all the way around.,20
positive,They are perfect for my Keurig.,20
positive,Lets you use your own favorite coffee.  Filters are a bit flimsy and could be deeper but they do work.,20
positive,Works well and is long lasting. Don't forget to turn the water supply off when installing.,20
positive,they are very easy to fill and clean,20
positive,Great,20
positive,"Here is my review after owning and using daily since Feb of 2019. Its now April 2021.<br />Great Machine. I've had NO problems mechanically out of the machine.<br />I've removed 1 star, this is because of the cleaning.<br />I've always used distilled water. I've always used the Opal brand cleaner.<br />It is IMPOSSIBLE to keep this machine clean without doing a deep disassemble every once in a while.<br />I followed the manufacturer guideline for cleaning and even used their chemicals for 2 years.<br />After 2 years I took it apart found it to be the most disgusting things I've ever seen. I can't believe I've been drinking what was inside.  My suggestion, use white vinegar as the official cleaner is overpriced now.<br />Clean it about every 2-3 weeks with white vinegar.<br /><br />If you have one and haven't taken it all the way apart, do it now. It will take you 2-3 hours to take apart, clean the tubes, clean the water tank inside (white tank with UV light), take out the metal cylinder in the center where the ice is made and pushed up through and clean in there. It will all be gross.  Maybe if you clean more frequently than recommended manufacturer guideline, it wont be, but if you find after cleaning a dark residue in the water holding area after a week or so, you need to take it apart.<br />Its not TOO bad to take apart.<br /><br />Overall makes the best ice, saves you $$, easy on the teeth. Even with the cleaning problems, I will continue to enjoy it.<br /><br />Below is my first review back in March of 2019.<br /><br /> I've had this a  month now. I wanted to give it a good try before writing a review.  Overall If you like nugget ice. Buy this you wont regret it. My cons, it is a little noisy, I keep it on my computer desk to have access to it and its louder than my PC.  The scoop, I tend to spill ice regularly when filling up a cup, but it could just be me, not the scoop. Overall these are minor things, and it is worth every penny. I've not used the cleaning kit yet, but will sometime soon. I'm sure all will be fine. The machine looks really nice, its heavy! The water seems to run out frequently and it is a little annoying filling up as when I pull out the ice tray some water gets on the table, but with the side tank which I've ordered comes in, I think it will be ALL GOOD and the perfect Ice machine. I think I need another one. One for home, one for the office.",20
positive,Was a little worried about spending so much on an internet buy. The washer/dryer came with no issues. The shipping was reasonable and came on time. Good product. Good buy.,20
positive,"I like this part, it's a perfect fit.",20
positive,Works better than the original.,20
positive,The filters are as described and delivered on time.,20
