sentiment,text,data_id
negative,"It's works but does not fit perfectly, will probably end up breaking quickly.",20
negative,"[[VIDEOID:937a87d5e9d3fe284036086fb80fa282]] I only had this item for three months.  It started to make the loudest noise after it dumped the ice into the holding tray.  Of course, the return window has passed, and the 90-day warranty is up.  If you are considering purchasing this ice maker, I would strongly NOT recommend it.",20
positive,I ordered without looking at the description.  My counter tops sit quite a bit lower than top of stove.  I even tried to lower stove to level out but the legs were already flush.  I think my granite is just thinner than most counter tops so these items will not work for my application.  They also seem really wide which detracts a little for me.<br />I liked the idea of metal vs silicone but I think the silicone maybe the forgiving way to go in my kitchen.,20
positive,,20
positive,I like it,20
positive,Works great. No refrigerator repair person needed,20
positive,"The one in my rental units dryer fell out, and I was drying shoes and some other things and it broke it. I am so glad I found this one because it fits better than the old one ever did.",20
positive,"Water so clean, it tastes like it came from the stream. Seriously- Sulfur tasting water is a thing of the Past!",20
positive,saved me a fortune on a service call solved the problem works like new,20
positive,fits right away,20
negative,Broken and a complete waste of money....,20
positive,Very expensive but did the trick and the lighting is now back to normal……really need to find generic alternative that doesn’t cost this much.,20
positive,Works perfectly!,20
positive,Shape of element is different than what was posted on Amazon. However still functional.,20
positive,Perfect,20
positive,I like that it filters extremely well so no debris goes in the cup,20
positive,"During the spinning cycle when using the small basket, the whole instrument trembles making a loud noise. Besides that it is a very powerful machine. I love it.",20
negative,I wished I would’ve written this long ago but I bought this refrigerator in 2016. Within a year the icemaker started freezing up. I had a local repair service replace the unit with one that Samsung provided for $300. I felt like it should have been free but I purchased it anyway. Within three months it was also freezing up. The repair person tried to contact Samsung service about it and was unsuccessful. Other than that I love the refrigerator but one star for faulty part and not making it right!,20
positive,"I have only been using this unit for one day, but it already far exceeds my expectations.  It is many times better than the very expensive GE Brand, I had 4 of those and never did get one to work.  This one makes ice quickly, easy to clean, big water take and is quite.  I will do another review in a month just to see how it is going since it is new to me right now.  Don’t hesitate to buy, perfect so far.",20
positive,"I knew nothing about installing this product, but it was very easy once I figured out how to take the washing machine cover off. FYI, each washing machine is different just use your brain lol!",20
negative,Purchased 2 of these and unfortunately they both came dented,20
negative,Worse than drinking straight from the tap.,20
positive,"Great value, perfect fit.  Still working after 7 months.",20
positive,"Great little filters, no more grains only pure coffee...",20
positive,Worked well!,20
positive,Works great 👍,20
negative,"From this week on, the range hood often goes downtime intermittently: when my wife was cooking, the machine suddenly went down on its own, and the button didn't respond and couldn't be restarted. It could be started after a period of time (such as an hour). This phenomenon occurs more and more frequently. Bad experience, I has applied for repair, if the manufacturer can not solve, I will make a high claim from Amazon.com.",20
positive,Really happy with this egg storage bin.  Love that it has a drawer so you dont have to pull the unit out of fridge to get an egg.  It is sturdy so you can set things on top of it.  I recommend this item.,20
positive,Very functional. Performs it's intended functions. Very nice for the money and works very well,20
positive,I have gotten these replacements more then once.  Great value,20
positive,"I ordered this product because I was not satisfied by the drain hose that was included in my new Whirlpool washing machine. This product is well designed and well made; quite sturdy. The end that connects to the washer is universal and is designed to fit different drain sizes; I cut the end to suit my washer. This is fine. The hose clamp that is included is an aircraft quality hose clamp; my choice forall applications that require a hose clamp.<br /><br />Overall, a very good product and I recommend this product!",20
positive,I ordered this for our keurig 2.0 oasis(K200) and we absolutely love the items. With ours I tested out the reusable filter cups without using the full menu clip and they worked fine. I think that if you're looking for reusable filters for Kcup and Kcarafe this is the way to go. You get everything you need and it's a great deal.<br />I would definitely recommend this!,20
positive,"Work perfectly.  2 for the normal 1 price.  A serious design flaw means these filters get clogged quickly.  I use a soft brush and my shop vac to clean the filter each time I empty the canister.  Even still, I have to replace this filter periodically.",20
positive,"It's everything I was looking for in a compact washing machine. Really does a great job getting my things clean!  Also love how easy it is to move around.  The spin/dry feature is wonderful too! I am very happy with my purchase, which by the way, is very reasonably priced for what you get.  I've used it quite a few times already and actually enjoy doing my laundry now!  Thank you for this great little machine!",20
negative,"First filter I bought was great, made the water taste like the GE filter. The second one however makes the water taste like plastic....",20
positive,good,20
positive,great replacement filter,20
positive,So happy with these filters.,20
negative,"I bought this for a Frigidaire air conditioner.  Once received, the D section to fit over the unit/knob was not long enough.",20
positive,Exact replacement for my Aprilaire 500,20
positive,"This device works great especially with pots and pans designed for Induction. I purchased a number if the T-Fal pans that has the induction logo and they are very good. My only criticism of the Max Burton is with the granularity of the settings. The jumps between temperature settings could be finer. Hence four stars and not five.<br /><br />My main reason for purchasing the Max Burton was to see how well induction cookers perform. I am in the market for a new stove top  or complete stove, and based on my experiences with the Max Burton, I will definitely be purchasing an induction cook top or complete stove.<br /><br />It amazes me that these devices are not more popular in the US as they are in Europe. Having read some of the reasons people give e.g. needing special pots etc. rather stupid. A parallel can be drawn here with the excuses for not buying Diesel automobiles. Again, rather stupid.",20
negative,Water flows very very slow...takes 3x longer to make a pot of coffee..disappointed,20
positive,The product makes plenty of perfect ice. Set up was easy with the correct parts.,20
negative,"Partially shipped, never received the full order, and can’t get a replacement or a refund .. highly disappointed..",20
negative,This product has serious safety issues! Buy it only if you are tired of your life! I really do not understand why Amazon let such a low quality product to still be on its site!! Obviously safety of customers has no priority here :((,20
positive,"[[VIDEOID:ce138567ae346678f73b2513e773a64b]] Small enough for counter, big enough for two people's dishes, glassware, & silverware.  Quiet, and very very  clean dishes.",20
negative,"My filter only lasted a month, very disappointing. I have order from seller before with no issuse, maybe my mine was defective. But disappointing since it was $50 and one would hope they last longer.",20
positive,Replaced 20 year old bulbs in Kenmore (Whirlpool) over/under freezer/refrigerator in the fridge section.  Fits in the slot length and width and illuminates similar to a restaurant/store cold drink fridge.  Not super bright but clearly.  Seems our food is easier to see now.,20
positive,Best price,20
positive,Arrived timely and in good condition. Fit my Samsung refrigerator perfectly. Rated NSF standard 53 which removes most chemical contaminates. Recommended.,20
positive,"Bought for my kennmore dishwasher, works great. Exactly what I expected. Very large so measure to make sure it fits. Fits all our silverware for our big family.",20
positive,Worked perfectly.  I also got one for  friend.,20
positive,"No real complaints, some of the abbreviations in the LED display could be clearer, I have to look up till I memorize but otherwise does the job. I have to say the sensor is very responsive, as soon as I open the door to the terrarium it immediately sense is a change in humidity and activates the humidifier connected to it",20
positive,Does the job,20
positive,Direct replacement. Would have thought the indicator that shows you when to replace the filter would have come with the filters.,20
positive,zi like this product because it keeps my coffee maker from undesired taste,20
positive,This is the best little ice maker ever<br />Makes little ice cubes and larger ice cubes,20
positive,Look just as described,20
positive,"Makes ice pretty quickly. I definitely recommend cleaning with lemon juice before use, because ours had a plastic taste. Once I let lemon juice sit in the water storage tank and ran some through the machine it was fine. Love the machine.",20
negative,"This product did get my dryer fixed, however two of the rollers that came with the kit did not fit the axles on my dryer. The back two are different size than the front two, The belt tensioner on my dryer was the problem that needed replacing and that worked out fine, however since I had the dryer completely apart, I wanted to go ahead and change out the four rollers as well. I could only change out two of them. All in all though, it did get my dryer back working.",20
positive,Nice customer service,20
positive,switch was correct part .packed well .price was about one half the store price saved a lot of time thanks<br />Frigidaire 134936800 lock switch for washer,20
positive,"Took a while to find this part as LG changed/discontinued the original part number for my gas range top. This replacement fit perfectly for my model LG gas range top. The anodized coating for the original griddle and this replacement is not as durable as it should be, so I expect I will need another griddle plate in 4-5 years. :( The next gas range will have a more durable griddle.",20
positive,"Did not purchase to be a milk frother, instead I use it for candle making. These are very nice and great quality.",20
positive,This is a great tool for doing what we don't do often enough - clean coils under our fridge.  Used on a Whirlpool & a Samsung.  Did the trick.,20
negative,"These did not fit my stove even though the listing states it would fit my Fridgidare stove.  It's nearly impossible to find ""universal"" replacement knobs for a stove.  All I needed was the connector that fits inside the knob to the mechanism on the stove.  I threw money away on these.  Do not order.  They will not work for you.",20
positive,Works perfectly with our Kenmore Fridge! and a super price,20
positive,Love,20
positive,Fit my model as stated dish washer works again!,20
positive,Works great and fits perfectly in fridge!,20
positive,"Works beautifully, no mess",20
positive,Easy to change. Great value for the money. Would buy again.,20
positive,Works fine for me in my furnace humidifier. Great price.,20
positive,Worked great for my Norcold N611RT refrigerator. Worked in both freezer and fridge. Fit perfectly.,20
positive,I like the price.  This was for a washer drain pump.,20
negative,Just over a year old and the entire inside is filled with mold in places that I can not reach. Worked great until this happened,20
negative,"I have a Sears/Kenmore humidifier, and posted plainly on the humidifier is this model number. However, it's the right height, right width, but wrong length. The top rests on the filter. This filter, being too short, does not support the top. I need a filter, Model # 32-14912, that is 2.5 inches wide, 11 inches tall, and apparently, at least 12 inches long. These fllters are 6.5 inches long.  A decent picture accompanying this product would also be VERY helpful!",20
positive,Easy to install and work well,20
positive,The product appears to be well made. Super easy to use right out of the box! We’ve had it 4 days and it has made my husband super happy!I am using specially filtered water in hopes of improving the lifetime of the machine.,20
positive,Perfect fit for my piece of junk Samsung refrigerator.,20
positive,I like product because it fit what I order it for and fast delivery  thank u Amazon,20
positive,works great! my freezer is working again!,20
positive,Size is perfect for making paint thickness froth for cappuccinos and macchiatos.,20
positive,the cabinet hood is totally what i expected it to look like...it's perfect for my newly renovated kitchen..the stainless steel hood is easier to clean .,20
positive,"Love love love this little washer! Was recommended by a neighbor. If you live off grid with solar,  this is the washer for you!!!",20
positive,Boxes falling apart as I opened packaging. I had to tape the individual boxes that hold each filter. What’s up with that????,20
positive,igniter works great fits perfect  for my frigidaire stove/oven easy to install,20
positive,fast shipping...as described. fits our refrigerator fine..I was concerned that it might not fit our maytag ref but it did.,20
positive,I liked everything about what I purchase from Amazon have not had a problem at all,20
positive,"I really enjoy cooking with the Verona. Has so many functions that can accommodate every kind of recipe!!<br />It fit perfectly in the position that I needed. The customer service was outstanding!  I spoke with Robert several times and he was an absolutely wonderful person to talk with, felt like we became friends. Very, Very happy!!",20
positive,Arrived a day early and does exactly what it was designed to do.  Easy install.,20
positive,Came on time. Just as described. Works fabulous,20
positive,I have sulfur water which is very difficult to drink without a very good filter.  This refrigerator filter is doing a great job. I am very pleased with this purchase and will continue to order this product.,20
positive,"The thermal fuse worked perfect, however there was something bigger wrong with our dryer so it blew again a few days later. The price was good and delivery was fast.",20
positive,Just what I needed to fix our oven. Great price quick delivery,20
positive,Authentic GE replacement part at a better price.,20
positive,Ok for replacement parts,20
positive,Works just like it should very happy,20
positive,"I love these bowls and lids. This was my 2nd time purchasing these bowls, just needed a few more than I had. One bowl from the assorted set was cracked, told seller, sent pics and they sent another set! Very fast. Thanks so much. Will be purchasing from them again in the future.",20
positive,Good quality element and your installation video was a big help.,20
positive,its going to take a while its no surprise your only using 12v to heat its up trust me i work on electrical things,20
positive,Works as advertised!,20
positive,"Fits perfectly, the quality does seems to be better than the oem filter.",20
negative,"Hi,<br />Product was as expected just one minor item missing, no USB to make sure firmware upgrades to see new fan. Kind of disappointed!!",20
positive,Depending on the washer you own it can be tedious but definitely worth it. The hard part is getting to the part and putting the washer back together. Replacing the part itself took 2 screws and 2 twist-ties. Total time was about an hour and I had a working washer. To call a repair man would have been days to weeks of waiting plus the add expense of a laundromat. This was much cheaper and faster. Google and YouTube are your friends!,20
positive,Just the right size took longer than expected to get it delivered.,20
positive,"I needed a 6"" shift of my dryer vent and this did a good job I ended up twisting the corners to keep it from moving after installation. It's light weight but still working fine",20
positive,Arrived quickly. I have no idea how I lost my filter. I just know it will reappear one day soon but glad ro get a replacement at a reasonable price with a plunger to boot. Guess they like to wear out over time so I'm all set there when the time comes.,20
positive,"I like it, it will be bigger than now.",20
positive,The tabs on this plastic part have a tough job to do in the dishwasher (holding up the top rack) so it's no surprise when they break off. The replacement is simple so finding them on Amazon makes keeping a stable top rack easy.,20
positive,Perfect fit for my Keurig.  This piece should be inspected often for splitting and dirtiness. This was the absolute best price for these seals as well.,20
negative,Freezes beverages and never stops running.,20
positive,Perfect fit and function. Would highly recommend and will buy again if needed.,20
positive,Works great with the Bee House Ceramic Coffee Dripper!,20
positive,Works as it should.,20
positive,Great value,20
positive,Works well,20
positive,Works good  just expensive,20
positive,Great product.  Sound level about the same as a faucet running.  Had a problem with the hinge but seller took care of it immediately. Make ice very quickly.,20
positive,"[[VIDEOID:d4b930f8f0fa7ba032dbbb2b2ff75e78]] Updating my review here, I’ve had this dishwasher a little over 6 months now. Fits well in small spaces and is runs quietly. But recently I started getting E1 and E4. I was concerned maybe it was kicking the bucket on me, but after messing around with it I had to stop using detergents. Occasionally I add a little vinegar to water for cleaning., anyways it’s back up to running normally . I did attempt to go back to detergents but it happened again. I believe it’s the episom salt in the detergent clogging the line. This line is smaller then the bigger ones. Detergents harden which causes the error messages. I use a little bacon soda along with a few drops of dish  detergent works just as good to clean your dishes. Do not put more then a couple of drops or it will over sud. A few drops goes along way in dishwashers. Also make sure you get food out of dishes. I have had this dishwasher for more then a year now or going on two. It still working.",20
positive,Very good quality magnet,20
positive,"UPDATE. AT THE ONE YEAR POINT IT JUST DIED. JUST PAST THE WARRANTY OF COURSE. PICK SOMETHING ELSE. Makes consistent ice cubes in two sizes. I like how it looks in my countertop as well!! So far, so good!",20
positive,The product arrived on time and all seems well.  It took me a few tries to get it properly installed - it takes a little strength to get it in and turned.  Once installed it seems to be working fine.  Water is nice and clean.,20
negative,"The end of the wiring of the new motor fan didn’t fit on my hood vent, had to cut the end of the wiring on the old motor fan and tape it to the new motor fan so I could get it to work.<br /><br />Not ideal, all the numbers matched too and everything. But it works now after getting it installed.<br /><br />Update: Fan stopped working after less than 2 months, 1/5 stars.",20
negative,"I did not buy this washer from Amazon, I bought it from Home Depot but I feel compelled to write this review.  My purchase was made on July 4, 2020.  I did not receive the machine until September 16, 2020 due to backorder.  From soon after delivery date until present, it has leaked from the bottom 5 times.  LG sends a technician out to look at it and that's all that happens.  It doesn't leak when he is here so he says that he can't fix what he doesn't see.  Beware!  This machine is listed as DISCONTINUED on Home Depot's website however, I see it is still available at Best Buy, Sear's Outlet/American Freight, was available until today at Lowe's and still obviously available here at Amazon.  DISCONTINUED means the model had issues and when it needs parts, you will likely be told that LG doesn't manufacture that part anymore so too bad for you!  Stay away from this machine!",20
positive,"Bought this as a replacement for a similar style one-cup coffee maker.  The water doesn't drip through quite as rapidly, as the surface area of the base is not as large, but it works well.  Tip:  Don't be fooled into thinking you've got to use one of those cone-shaped coffee filters with this, however.  Just use a regular sized drip coffee maker filter, fold it in quarters, fit it into the plastic cone and open it, and add the coffee in one of the &#34;pockets.&#34;  So much more economical than those expensive name-brand filters.",20
positive,These are a direct fit in my fridge.  I would have paid $49 for ONE filter at a box store.  These four were slightly less.  Great product and great price.,20
positive,These replacement wheels work great. The old wheels are removed very easy and the new ones are installed very easy.,20
positive,As described,20
positive,Coffee brews thru better. Love them,20
negative,Came Broken!,20
positive,This is a nice coverup for my old dishwasher.,20
positive,"It seems like it's in defrost mode as much as it's making ice. I wanted to run it a few times before writing this. 2 hours gets you about half a basket of ice, it's better to transition it to the freezer once defrost mode kicks on or your ice will get wet or is in the process of melting, not sure which. You can tell by the sound the machine makes approximately when it's getting close to the defrost time.  It will make kind of a squeaking/strained noise.<br /><br />I like it because it means less ice trays in the freezer.  We did have to find an out of the way spot to run it because it's big, but since it can have a water supply or just filling the resivour, it can be placed just about anywhere.<br />I would recommend this for those who like nugget ice, I like it because I can have just ice with the squeeze flavor and it's like a snow cone in a cup.",20
positive,Just what I wanted. This is very sturdy and fits on my fridge shelf perfectly.,20
positive,"The filter fits more snugly than paper filters, but it works fine; there is no leakage.",20
positive,Perfect Fit/Easily Installed!,20
negative,Basket completely detached from handle/rim.,20
positive,"The Samsung stove/range nob cracked, so I got these replacements.  These nobs are dimensionally the same.  I can't tell the difference.  The only noticeable difference is the font of the words are slightly different, but not enough for me to care.  I just put the replacement nob in the center range.  The other plus is that these are beefier in the area where it had cracked earlier.  So i expect these to last for quite a while.  If not I got 3 extras.",20
positive,"Ordered as an alternative to original Kenmore replacement part. Snapped in with minimum effort. Worked like original. I've only been running it a week but, it's doing the job.",20
positive,"Perfect fit to replace the lid I cracked.<br />Not the exact color, but it does the job.<br />Who cares!!",20
negative,Hope it works.  Lots of dents & scratches. Even had to straighten out the door hinges & feet.,20
positive,Great price and seems like a quality replacement. Very happy with purchase.,20
positive,LOVE this sloth dishwasher indicator!!! Already has had many compliments!,20
positive,"This was a bit pricey,  but was a perfect fit and nice and sturdy.",20
positive,Great value and exact fit for our refrigerator.  Will purchase again when we need more!  Received promptly!,20
positive,The description says this is a full size refrigerator but that is not the case in my opinion. The dimensions listed in the add are correct and this fridge was what I was expecting.  I am running out of space in my garage and wanted to replace the full size fridge I had in the garage with this. We’ve been using it for the past 2 months and it has met our expectations.  Ours arrived in perfect condition and we are 100% satisfied.,20
positive,"Awesome, they work quite well.",20
positive,As listed. Nice high quality. Does not feel cheap or thin like some.,20
positive,Great price and easy install. Doesn’t block out everything that the high end name brands do. But bang for buck is good.,20
negative,I normally order this item and it lasts me for months . This was my first time ordering from this company and within a month my machine asking for it to be replaced . Be cautious there is a reason it’s less expensive,20
positive,"I am very picky about the things that I consume. I make cold brew coffee on a weekly schedule and much prefer it to hot brew. All of the coffee that i have used, both pre-ground and grinding at home, leaves a very fine powder in the coffee that creates a gritty feel to the beverage. This sifter does a much better job of removing these 'fines' than the K***e unit that I also have.<br />I would much appreciate a version of this sifter that had at least 2 and perhaps 8 times the capacity (I use 3 or 4 ounces, by weight, every time I  make cold brew and the time to sift that much coffee is unacceptable.",20
