sentiment,text,data_id
positive,"[[VIDEOID:9e7cf191072d362ae57b2ac1dbbdbf9d]] I love it!!!! I spend so much money to find a perfect reusable K-cup! It works well, it’s easy to clean, coffee tastes great and most importantly I am happy! I bought other k-cups and they didn’t work, just waist of money!  Thank you",20
positive,"Arrived on time, delivered by two friendly guys. Hooked up easy and works like expected. Money well spent",20
positive,Life saver. Perfect fit and shipped quickly,20
positive,did the trick,20
positive,"I blame myself for not checking the measurements and assuming all fridges are universal. Make sure to check your measurements before ordering. Ours is a GE Profile and our drip tray is fairly shallow. The kids (ahem, and adults) are always leaving drips of water which cause calcification. Drives me nuts. We had gotten in the habit of putting small washcloths on the drip tray, but this is a more aesthetic solution. Not sure how absorbent the material is, it is kind of like a squishy mat. Tip: if you don’t want to drive your type A wife bonkers, use a straight edge and box cutter to make any necessary cuts and don’t eyeball it with scissors!",20
positive,Works perfectly,20
positive,"Recently got a new fridge without built in ice maker, missed it terribly. This machine works perfectly and is a great substitute! No more ice cube trays!!",20
positive,"good water flow, cleans the chlorine taste",20
negative,Ice maker worked great. Grew mold in the back parts that are hard to clean. It’s a medium noice level. QUIT WORKING after a year.,20
positive,works great,20
positive,"Hard to get on, but good replacement",20
positive,Cheaper than Lowe's and works just fine,20
positive,Great deal for the price. Enjoy being able to see the different ratings. Wish it would stay illuminated so you can see it from across the room.,20
positive,I could only get 2-3 turns by hand.  I had to wrench them the rest of the way.  I guess it's better to be tight than loose.,20
negative,"However they are made of very thin material. When the old ones stood up to regular cleaning and even scrubbing, these replacements will likely not last more than a few months.",20
positive,I ordered this about 24 hours ago and had it to my door about 6 hours ago. It was a breeze to install and had my fridge working like new within 10 minutes. As simple as can be.,20
positive,Easy to install,20
positive,fits well works as decribed,20
negative,"People you are CRAZY if you buy this fridge!  We bought ours a little over 2 years ago, worked fine till a couple of days ago.  Called out a repairman, he came out and I told him it wasn't cooling, he said ""uh oh, I think I know what's wrong with it, common for these Whirlpool refrigerators.""  So he proceeded to take the back off and check a few things.  Says there is a refrigerant leak in the ""sealed system""  And he said that unfortunately they stopped giving a 5 year warranty on this, now they only warranty it for one year.  But the really bad news is its not repairable... they leak is in the coils between the fridge and the freezer, they are molded inside and you cannot get to them.  So therefore it cannot be repaired.  So I did a little research online... this is VERY common for Whirlpool side by side fridges... Found 100s of complaints and not one of them said Whirlpool took care of their problem.  Even found one website where someone used to work for Whirlpool and they know this is a design flaw but will not do anything about it!  That's why they changed the warranty from 5 years to 1 year!!!!  And its not just this model, its all the side by side models!  NEVER, NEVER, NEVER will I buy another Whirlpool or Maytag product again!!",20
positive,It’s too noisy sadly,20
positive,on second year of trouble free operation,20
positive,Perfect fit.,20
positive,"i love this little guy! i live in an apartment complex with coin-operated laundry, and i was getting tired of the agitators wrecking my clothes/cruddy apartment laundry generally. i've also been trying to go lower waste over the last few years, and i have adhd. this thing is perfect for all three: no agitator (but gets my clothes clean), non-electric, and super squirrel-brain-friendly :)<br />with adhd, i normally put off laundry for waaaaay too long, which means once i have an insurmountable pile of clean clothes, i put off folding those for even longer. i love this thing because i can just throw a few things in at a time, it's easy to operate, and when im done washing/rinsing, i can stick the drain-pipe in and just walk away for a little while. it really breaks laundry up into small, accomplishable tasks, so i don't dread doing it quite so much anymore! plus! it's so cute!!<br />my only drawback is that i wish the legs were sturdier. they just aren't heavy enough, and when the basket is really spinning, they tend to get a little rickety. generally pretty avoidable if i rest my feet on either side, but i do have to rest my feet on either side. the fact that they include ""suction cups"" for the legs at all is..... really funny to me. they don't do anything at all! but i still love the machine, workaround and all :)",20
positive,The oem switch gets brittle and goes bad over time. This is the perfect direct replacement. Take photos of the wires before you unhook the wires.,20
positive,"this item is manufactured by one company from China, a supplier of OEM parts for LG, and other companies, so don't over pay for it from somewhere else thinking that you will get a better product.",20
negative,"Simply doesn’t do what it’s supposed to. I bought these as I wanted an alternate to keep making rounds to store to buy distilled water. Started using these last week on two guardian humidifiers, and it doesn’t reduce white dust at all. Waste of money. Looks like distilled water is the only solution to white dust problem.",20
positive,As described.,20
negative,"Literally the worst thing I have ever bought.<br />Worked great a few times. Then quit washing. I was using pods and they weren’t fully dissolving. So switched to name brand detergent. Didn’t make a difference. Dishes were still disgusting. Tried lightly used dishes. Like coffee cups. Nope didn’t clean at all. Tried an extremely light load. Nope. Doesn’t matter. Tried the heaviest setting on this thing. Nope. No difference. Contacted the company and was sent another one. I was thrilled because I thought maybe I just got a defective one. HA. 2020 has jokes. This dishwasher is for sure one of them. First cycle with the new one - didn’t do anything. THEN I thought I’d give it the benefit of the doubt and put some lightly used items in. Just to see how they’d come out. Water didn’t drain properly with this cycle. So like the sticker said on the front of the machine - slightly tilt, which isn’t easy because this thing is heavy and bulky. All the water still didn’t empty. Which forced me to carry it outside and empty it. Piece of garbage.<br />Noise level wasn’t awful but not great for the price you pay.<br />The icons on the front are hard to read and you have to reference the manual several times to get used to the icons.",20
positive,"Este es el segundo set de cápsulas que adquirimos, su duración es alrededor de un año por cápsula. Su uso es sencillo desde el relleno hasta el lavado para iniciar el siguiente ciclo. Ningún problema de compatibilidad. A esto agregamos el que se puede utilizar el café de su preferencia.",20
positive,Fast service! Exactly what I needed to repair the dryer! Thank-you!,20
positive,Set up is pretty easy. It has detected an unintentional open door once already. It subtly reminds you to shut the door when you’re through when it makes a tiny beep when you open the door. So glad I thought to search for such an item before I knew it existed.,20
positive,"SEEMED TO WORK VERY WELL, EASY INSTALL, DOES TAKE A MINUTE OR SO FOR SURGE CURCUIT TO SET UP WHEN FIRST PLUGGED IN ,GREEN LIGHT COMES ON, THEN POWERS FRIDGE. THE 90 DEGREE PLUG ORIONTATION IS A GREAT SPACE SAVER. WOULD RECCOMMEND!!!",20
negative,This doesn’t work! I can’t close my Keurig coffee maker.,20
positive,"So far, so good. The way my basementwall is, I couldn't mount the vent. I had to lay it down on its side but It seems to be doing a good job. The only problem I have ( and it could be my dryer itself) the airflow pops the item off. I have a combination metal and attached plastic elbow and taped them securely to the vent and occasionally it still pops off; it may be from the heat of the dryer air drying out the tape. However, I am still very happy with this. It may be a bit pricey but I haven't found anything else that works as well so I am pleased.",20
positive,So happy I found this my stove looks new. Works great.,20
positive,Works great!,20
positive,I ordered this part from the company and it was going to cost me almost $100. Thankfully I used smarter judgment and ordered from Amazon. This is perfect.,20
positive,"My old door was rotted through.  This one is solid, well made, and fit perfectly.  No need to pay more.",20
positive,Bought this for our Samsung fridge. Less expensive than the actual Samsung filter and it fit perfect.,20
negative,"I thought this would be a lot cooler than it is, even if it is a thermal electric product.  Doesn't seem to get any cooler inside except for the actual circle on the bottom.  Also if you pick it up after its been running, water will leak out of the back of it.  Its a cute novelty item, but if you really need it to keep something cooler then the room temperature its not worth it.  BTW, I bought it to keep on my bedside table to store open insulin in case of emergencies in the night.",20
positive,no test port,20
positive,"While it is good that the product works, I was even more impressed by the level of customer service received. I was concerned that the product did not match the original replacement, so I reached out to the seller. They were responsive and thorough. Awesome!",20
positive,Fixed our leaking dishwasher!,20
positive,"The element came well packaged, went in easy and heats great!",20
positive,Love 1 easy storage space,20
positive,Fits perfectly. Sometimes the paper filters would fold over and let grounds into the pot. That has been eliminated. Plus I feel like the taste is better.,20
negative,No joy.  I mean none.  I watched the video linked from their website until I had a headache and had the two pieces included in the kit in and out 4 times.  When they're in the screen says Oops! regardless.  When they're out it works with the refillable cup I got from Wal-Mart for less than $5 but not with any of those from the kit.<br /><br />Whoever designed their website and the documentation in the kit should be doing something else.<br /><br />I've just sent an e-mail to Geesta and shall amend this as appropriate.,20
positive,"Easy to install, strong",20
positive,Perfect fit,20
positive,This is my second time ordering the mesh filter. They last about 1 full year. It's really wonderful not to have to keep paper filters on hand and these are super easy to rinse out to clean.,20
positive,The original in our oven burned out and decided to give this one a shot. Arrived well packaged and was a quick easy install. Have had it for a few months and it works just fine.,20
positive,"Easy to use. Works great. No freezing mechanism in machine. Therefore, water drips from the time you take out the basket of ice until you get it to the freezer bin. Since the ice is wet, it will freeze into clumps. Makes it difficult to retrieve the ice when needed. Due to the size of our freezer bin we use the machine every other day.",20
positive,"GREAT ice maker!!  We've had this for a month, and have used it every single day!  It's simple to use, the ice cubes are made SO fast, the machine hardly makes any noise at all.  Cannot recommend this ice maker enough!  It is EXCELLENT!",20
positive,Fits perfectly,20
positive,"Works as intended, nothing special here.",20
negative,Didn't realize that it came with one large burner tray and three small. Nothing wrong with the quality but inconvenient because ya can't buy a single,20
negative,Brewing in this makes your coffee squirt in a dozen different directions as it comes out instead of a straight down-pour out of the keurig. Super annoying.,20
positive,works great,20
positive,Awesome height n very well care from shipping,20
positive,"I used this item for my double door refrigerator, the door handle kept banging into the cabinet.<br />Problem solved instantly. They are attractive enough not to stand out,  or glaring ....Perfect solution to my problem.",20
positive,"Item arrived as scheduled, and though we found it wasn't the problem, it was installed & works great!",20
positive,I do not know where they made. But I replaced it about 2 years ago. Its working good now. Everything works great. My wife left open refrigerate door over night. Compressor is running but not cooling.<br />So I changed little fan and motor first. Changed the capacitor and start relay but not work. Changed over load switch still not work. Changed control board then it did work. I should check the switch by electric tester first. Now my 15 years old GE profile double door refrigerator working like new.<br />****Now December 2021  my  GE refrigerator still working good.******,20
positive,"This replacement PermaWick filter is a replacement for the one I have in my Hunter Humidifier. Installing it takes about 5-6 minutes, and these do require periodic cleaning.",20
positive,Took a lot of effort to remove panels to get access without breaking anything.,20
negative,"Very nice size , needs Freon constantly<br />Can’t be fixed",20
positive,"Love this ice maker! Bought it to use in our RV when camping, but we like it so much we end up using it in the house as well! Item arrived earlier than expected and was packaged unbelievably well. It does make an audible  humming sound while running but it is nothing that bothers us.  We love it!",20
positive,Works great love having my dryer back,20
positive,"They work well, but shouldn't cost as much as they do.  Not what I call GE taking care of their customers...",20
negative,No good cheap and my opinion no good,20
positive,These filters are amazing very easy to install,20
positive,I bought these for my new Keurig when the old ones didn't work on the new device.  They work to allow me to drink from grounds.,20
positive,"Love this product.  I brew my loose leaf tea (Rooibois) at work in my mug and it's very discreet.  There are NO pieces of residue tea leaves in my cup after the brewing is over.  Also, I let the basket sit in the lid until I decided to brew a second cup or clean the basket out later.  The basket is wide enough to clean easily and slip back in my desk to be used the following day.  On a side note, after four weeks of drinking this tea and omitting coffee and black tea at work, my blood pressure went from 135/80 to 120/70.  I have suffered from high blood pressure for 17 years and have NEVER had such amazing results (even with medication and a healthy life style).  So, I will be guarding my Finum Brewing Basket with my life.",20
positive,That's all right,20
negative,I'm surprised by the good reviews for these because for me these cones drain SO SLOW I can't stand it. It takes double the time to make my coffee. I have been making pour over coffee exactly the same way for 5+ years with various brands of cones and have NEVER experienced such slow draining.,20
negative,"These stick very well to emptied Nespresso capsules that I reuse. They do not stick well to my sealpod capsules. I suspect it's the glue. If I prepare them in advance, overnight they start to lift up. Also, they tend to break apart in the center during brewing. I thought it might be from my grounds expanding against them, but my sealpod lids do not crack like that. While they are cheaper than the sealpods, I don't think I will reorder them.  I'll continue to try other brands looking for a less expensive option perhaps, or just stick with sealpods (pun intended).",20
positive,it the best,20
positive,"I was given kcups coffee for a gift but did not have a keureg coffee maker. I have tried different coffee filters, but always got coffee grinds in my coffee. With this filter, I only have to set it on top on my mug with my coffee in and run hot water into the cup. It sits on top of the cup and keeps grinds out of the coffee. It can seep in the cup and then remove and drink. It is reusable and easy to clean. It is easy to transport to office or whereever. My daugheter kept &#34;borrowing&#34; mine so I had to order me another one. I now use it every day. I highly recommend this to anyone needed to make 1 coffee cup at a time.",20
positive,"Idk why there’s so many poor reviews! This machine came to me well packaged & perfectly intact. I use the eco cycle and it cleans my dishes amazingly. All I had to do for installation is attach it to my sink. It’s a little bit leaky in my sink (at the connection) I think some teflon tape would fix it.<br /><br />Main issue I had with this: the plastic mechanism it came with to organize the plug & faucet connections did not work. I’m not sure if it’s the wrong one, but I ended up putting a hook up above where I store this machine so that was he plumbing didn’t leak everywhere after use. If it’s not upright the residual water will spill all over the floor.<br /><br />Overall, I’m very happy with this cute little machine. Now I don’t have to do any more dishes!",20
positive,"great item, great price fit exactly.<br />better quality than the original, this one is metal the original one is plastic",20
positive,Water taste great!,20
negative,Only lasted three months.,20
positive,This was everything I was hoping for. The only thing I don't like about it is that I don't feel like it stays super cold on there so when the bucket fills I dump it in our freezer. Which isn't really a problem for us at all. Seens as how our ice maker is right next to our fridge. Other than that it's top notch foe the price. Cubes last a long time in my drink even though they are not huge.,20
positive,Exact part,20
positive,Value for money,20
positive,"Screws seem to big to install kit, after drilling open a bit to loosen holes I was able to get them in. Small hassle but otherwise worked fine. I would recommend.",20
positive,Great price.,20
positive,Nice way to still use your own ground coffee.,20
positive,"Had a hiccup when delivered. Phoebe responded within an hour, and then shipped the missing part asap, I got it within 48 hours. 5-star service!",20
positive,Did the job for a quick fix to repair the washing machine.,20
positive,Perfect fit...easy install,20
positive,"My dishwasher had a burnt electrical smell (no smoke) and after some investigation, seemed to be coming from this part.  Replaced it and no more burning smell!",20
positive,I was nervous about this fitting properly. I guess its a pretty standard size for several fridges. Perfect fit and good price compared to the other ones I found available online.,20
negative,"Great price, fast shipping but the filter did not allow water to pass thru!  Obviously defective from the box.<br />The filter is smaller in diameter and slightly shorter than a Samsung, but did not leak - just didn't allow water thru!",20
positive,Our fridge is old so parts are starting to crack but the fridge itself is fine. It was looking pretty junky so I looked up the shelf through whirlpool and it was $100. Found this knock off and was so happy it worked. I have a couple others I need to update.,20
negative,"1. Before installation it is important to completely submerge the filter in water and turn it where the water entrance (looks like a coin slot on the bottom of the filter) is under water but tilted up and rotated up so that the air can come to the uppermost point and exit the filter so then the filter can fill (prime) with water completely.<br /><br />2. For installation, make sure to tilt the filter down and position the round male end into the icemaker's filter receptacle. Then push the opposite end down to secure it in place. The angle is important to allow the male end into its proper place otherwise the filter will seem as if it will not fit. I did not have this issue but saw other reviewers had trouble with the fit and wanted to ensure everyone knows to install the filter initially with the male end down and the larger end at an angle up.<br /><br />Before installing this filter just to ""start fresh"" I performed the cleaning cycle with bleach then performed the overnight cleaning with white vinegar to remove scaling. I then performed the bleach cleaning cycle again. I was able to cycle water through the machine with no problems before installing the filter.<br /><br />Initially since the instructions did not include directions for priming the filter I installed without priming it with water first. The icemaker gave me the add water blue light code so I removed the filter and reinstalled it but got the same error code. (I went to my trash to ensure I had removed the plastic overwrap before installing!! LOL, yes, I had!) I then submerged the filter in water and ensured it was full of water with no air bubbles exiting the filter before installing. The icemaker worked then but the next day after a time of being turned off I had to remove the filter again and resubmerge in water and reinstall. I also drained some water without the filter as if to clean the machine just to ensure there was no clog internally and found no issues. I reinstalled the filter and since then the icemaker has not given me the error code and has so far worked with the filter installed. I am writing this 2-3 days after initial installation. (SEE UPDATE BELOW)<br /><br />Notes for me to try with next new filter if this one doesn't continue to give me trouble: Try installing the filter without priming but with no water in the ice machine after cleaning (before adding water to the water reservoir). I already had water in the water reservoir below the ice drawer on initial installation so perhaps that added an air gap that prevented the proper water flow initially.<br /><br />I posed the question asking if priming is necessary in the questions section of this item and received responses of yes and no so if you are having trouble try one way or the other or both. :-) GE's answer was that priming is not necessary.<br /><br />I agree with other reviewers that the filter instructions could be written with a lot more clarity and details. (The Opal ice machine instructions could use the same update.)<br /><br />I'm not convinced it is a good value for the money. It is priced twice as much as other filter models by the same manufacturer for the same icemaker but not sporting the GE Opal logo. Of course GE Opal recommends their branded product as the only filter they endorse. I feel I'm paying twice as much for the brand.<br /><br />My ice has still been tasty and chewy so I'm happy. I may detect a slightly cleaner taste but not a huge improvement overall. I would say the cleaning may have improved the taste in addition to the filter change. I clean my machine if the ice production slows down, about every 2 to 3 months. I have been using tap water which leans hard vs soft. Hopefully the filter will extend the amount of time between cleanings. Time will tell....<br /><br />UPDATE (approximately 5 days after initial installation)<br />My Opal machine is on a schedule so today when it turned on I once again got the ""needs water"" blue light code. I removed the filter and ""primed"" the hole the filter fits into by pushing my finger on and off the hole as I read somewhere online this troubleshooting method. I then reinstalled the filter and my machine is again making ice. I'm trending towards thinking this filter is not worth all the extra attention I'm having to give it to coax it to work with my ice machine. I'm reducing to 3 stars from 4.<br /><br />UPDATE (approximately 6 days after install)<br />Once again have the needs water blue light code after turning on. I will message the seller about getting a replacement. I have reduced my review from 3 stars to 2)<br /><br />UPDATE (after receiving replacement filter)<br />I returned the initial filter and received a replacement. Unfortunately I am still getting the *needs water* blue light. I have tried all the above methods again to no avail. I have returned the 2nd filter for a refund and my chewable ice will be made with filterless water. I don't think this product is worth trying. I've made a valiant attempt to get this it to work, tried more so than most, and am reducing my assessment by yet another star...Final Answer.",20
negative,"This part is NOT W10366605. It might look similar, and the part sold is completely different than the picture shown if you read the numbers on the circuit board. It is misleading, disappointing, and total waste of time. Amazon did great in returning, but Amazon should have vetted these merchandises before they can be listed using OEM part number. It is such wasted time, effort and resource.",20
positive,I love this ice maker!! It’s fast and easy to use!!!,20
positive,Exact fit and replacememt,20
negative,"This ice maker worked great for 5 months & now it just stopped working for no apparent reason. It hasn't been moved, the only thing that changed is now it doesn't make ice! I've owned several portable ice makers, I've never had one stop working in 5 months! Amazon isn't willing to help me so I reached out to Novete & I haven't heard anything back yet.",20
positive,Product worked as expected.,20
positive,"Works well, easy to use!",20
positive,Me encantó el producto funciona muy bien atrapa toda la pelusa de la secadora,20
